index;hotel_rule
4;"Orders for accommodation services made in writing or by other means, which have been
confirmed by the hotel and have not been cancelled by the customer in a timely manner, are
mutually binding. The front office manager keeps a record of all received and confirmed
orders.£
The hotel may provide accommodation only for guests who register in the regular
manner. For this purpose, the guest must present a personal document (citizen's
identification card), or a valid passport to the receptionist. Accepting these Rules of the
House is also obligatory for the registration.£
Accommodation in the hotel is permitted only to persons who are not carrying infectious
diseases and who are not visibly under the influence of alcohol or drugs.£
In special cases the hotel may offer guests other accommodation than has been agreed
upon if this does not fundamentally different from the already confirmed order.£
Check-in is possible from 14:00 on the day of arrival. On the day of travel, the room must
be vacated by 11:00 at the latest.£ If our guests require early check-in or late check-out, they
must contact our hotel reception in advance. Our colleagues may provide this service upon
availability and with possible extra costs.£
In the case that a hotel guest requests an extension of the residence in the hotel,
reception may offer this guest a room other than that in which the guest was originally
staying.£
Hotel guests may receive visits in their hotel rooms from guests not staying in the hotel.
Visitors must present a personal document at the hotel reception and register in the visitors'
book. These visits can last for only a maximum of 2 hours and must finish until 10:00 pm.£
Hotel Charles enforces a ’No In-Room Party’ Policy to ensure we can protect the hotel and
our guests at all times. No parties, loud disturbances and/or noise-nuisance are allowed or
tolerated on these premises. £ In the event of a disturbance, one polite request (warning) will
be given to reduce the noise. If our request is not followed, the guest will be asked to leave
the hotel without refund and may be charged Guest Compensation Disturbance Fee.£
Between the hours of 10:00 pm and 06:00 am guests are obliged to maintain low noise
levels.£
Guests may use rooms only for the period, which has been mutually agreed with the
hotel reception, at the latest until 11:00 am on the departure day. £ If a guest fails to vacate
the room within the designated time, reception shall charge this guest for the following
night's accommodation fee.£ For a possible late check-out please consult with the reception
in time, and upon availability we may grant a later check-out for a supplemental fee.£
Guests who take accommodation after midnight, shall still pay the price for
accommodation for the whole of the preceding night. The hotel’s official Check-in time is
from 02:00 pm. For a possible early check-in, please consult with the reservation team, or
the reception in advance.£
Guests may not move furniture or interfere with the electrical network of electrical
appliances or other installation in any way without the consent of the hotel management.£
Guests may not use their own electrical appliances in the hotel building except for those
serving for personal hygiene (electrical shavers or massaging machines, hairdryers etc.), or
personal computers and telephone chargers. The rooms own electrical devices shall only be
used according to their main purpose.£
Upon leaving their room, guests are obliged to turn off all water taps, and to turn off all
electric lighting and other electrical appliances in the room and close the door. Guests bear
full responsibility for any damages, which ensue from failure to abide by this prescription.£
Hotel guests are responsible for given room keys during their whole stay. In case of loss, the
guests are asked to inform reception staff immediately in order to prevent abusing the key.
Losing the room key will result in a penalty of 20 Eur, which is to be paid on the spot, at the
reception.£
For safety reasons it is not permitted to leave children under 12 years of age in hotel
rooms and other common areas of the hotel without adult supervision, and children under
12 years of age may not use the lift without supervision.£
Guests are responsible for damages caused to hotel property according to the valid legal
prescriptions of Hungary.£
The hotel’s inner courtyard parking facility may be used only upon availability of parking
slots. Slots marked as ’Private’ are to be left free for their owners. For parking fees please
consult the reception or see the website of the hotel.£
Guests are obliged to pay the price agreed upon according to the written confirmation of
their reservation. ‘On the spot’ payments for accommodation and other services are to be
made at the beginning of the stay. The bill is payable upon presentation to the guest.£
We shall be happy to listen to any suggestions for improvement of the accommodation
and catering services in the hotel. In case of any complaints we shall purposefully arrange
the rectification of any insufficiencies.£
Dogs and other animals may be taken into the hotel premises only with the consent of
reception for a surcharge 15 Eur/animal/night (max. 2 animal / room). Their owners must
thoroughly abide by the instructions of reception.£
The pet is socialized, vaccinated, and has no fleas or ticks.£
The pets can not be left without supervision if there is a risk of causing any
damage or might disturb other guests.£
Animals may not be allowed onto beds or other furniture, which serves for
guests. It is not permitted to use baths, showers or washbasins for bathing or
washing animals.£
Utensils, which serve for preparation or serving of food to guests, must not be
used for feeding dogs or other animals.£
Owners are responsible for ensuring that animals are kept quiet between the
hours of 10:00 pm and 06:00 am. In the case of failure to abide by this
regulation the guest may be asked to leave the hotel without a refund of the
price of the night's accommodation.£
Owners are fully responsible for any damages caused to hotel property by
their animals.£
Pets are allowed in the hotel restaurant only from 12:00, provided the
animal's behavior and cleanliness are adequate and they do not disturb other
guests. £ Pets are not allowed in the restaurant during breakfast time
(7:00 – 10:30) for hygienic reasons due to the breakfast’s buffet style. An
exception is the case when the hotel terrace is open, as pets can be taken to
the terrace through the hotel's main entrance and they can stay there during
breakfast.£
During their stay in the hotel, each guest is obliged to act in such a manner as to ensure
that their conduct does not cause the outbreak of fire. Fire alarm escape routes are
displayed at the inner side of each guest room doors.£
In the case of fire, guests are obliged to notify the reception without hesitation, either
directly, or on the phone (0) and may use a portable fire extinguisher located at the corridors
of each floor to extinguish the flames. The use of the elevator in case of fire is prohibited!£
Smoking is prohibited in the whole building of the hotel (both in the rooms and in the
common areas). Violation of this rule will trigger a penalty fee of 100-200 Eur depending on
the smoke odors experienced in the room, and the amount is calculated by discretion of the
hotel.£
The hotel shall ensure provision of first aid and helps organizing a transport to hospital in
the case of sickness or injury to guests.£
Entry to occupied hotel rooms is permitted to the chambermaid who is allocated to the
given room, the hotel housekeeper, the accommodation manager and maintenance staff in
the case of reporting of a technical defect in the room.£  If you do not want someone to enter
your room, please hang the ""do not disturb” card on your room’s outside door handle. It can
be found in the entrance area of your room.£
Consuming the products from the minibar involves additional costs. You can find the
prices in the kitchen area.£
Washing machine – available at an extra cost on the 6-th floor. Please contact the
reception for further information.£
Drying machine - available at an extra cost on the 6-th floor. Please contact the
reception for further information.£
Microwave oven – can be requested depending on availability. In case of longer stay
(weeks) it is an equipment of the kitchenette. Please contact the reception!£
Hotel guests are obliged to abide by the provisions of these hotel regulations. In the case of
serious violation, the reception or hotel management may withdraw from the contract on
accommodation services before the elapse of the agreed period.£ In cases where the hotel
suffers damage (either physical, or moral) due to the guests’ violation of the above rules, it
may charge a compensation fee in proportion to the damage. Moral damage may be for
example disturbing other guests, thus ruining the reputation of the hotel.£
We request that guests report any complaints and defects to the hotel reception or hotel
management in person. Your complaints shall be attended to immediately.£
These hotel regulations are available to guests in their rooms, at the hotel reception, and on
the hotel’s website: www.charleshotel.hu £"
5;"In all the hotels, managed by Blu Hotels, only small and medium pets - whose weight is equal or
less than 15kg - are welcome, when they are accompanied by their owners.£
In order to ensure a comfortable stay to all our guests, we have developed the following rules –
in accordance with the current main rules and with needs of civil cohabitation – and we kindly
ask you to read them carefully.£
All pets must be in order for what concerns the health aspects, and in particular they must have
vaccinations.Upon a simple request from booking office and hotel staff, pet’s owner must show
the health card.£
Animals are not allowed to access or to stop, in all the areas where food and beverages are
served. It is therefore not allowed the access to restaurants, bars, terraces, areas where there
are distributors for food and beverages, whether indoor or outdoor areas.£
It’s strictly forbidden the access and the stop in common areas like sea areas and/or areas
equipped with sun beds or deckchairs, beaches, swimming pools, miniclub/juniorclub and
animation areas, playgrounds, wellness centers, multi-purpose sports fields, conference rooms,
ski and sports equipment deposit.£
In other common areas it is allowed only the transit of pets as long as always accompanied by
the owners and with the requirement of using the leash and have an appropriate muzzle.£
Pets owners accept the complete responsibility for any and every damage caused by their animals.
They will have to arrange with the reception staff the specific time when it will be possible to
clean the room.By that time pets must be outside the room.£
They also undertake to remove any excrement and/or dejection left from the animal in all the
areas of the hotel. Therefore, pets owners must have appropriate plastic envelopes and specific
instruments for this purpose.£
The stay of pets is allowed only upon the payment of an extra supplement, indicated in the price
list of everyhotel.£"
6;"In order for our guests to have a safe and comfortable stay, we have set the following rules and
guidelines based on Article 10 of the Accommodation agreement. We expect and appreciate
everyone for their cooperation. If the rules stated are not observed or violated, hotel management
will reserve the right to refuse the guest service of accommodation and use of hotel facilities. Guests
may be also held responsible for any damages incurred.£
The evacuation route map is installed at the back of each guest room door so please
check when you arrive in your room.£
Please refrain from staying if you are not a registered guest.£
We do not allow minors to stay without a guardian. Also, we may refuse guests due to
mental and physical concerns, drugs, drunk guests and other acts that may cause
disturbance to other guests.£
Please note that long-term accommodation will not give legal residence rights.
We ask for your cooperation in saving electricity and conserving water resources carefully.£
When leaving your room, please make sure to bring along your room key and to check if
it is properly lock.£
Please make sure to lock the door latch when inside the room or when sleeping.
A 3,000yen charge will be imposed as a replacement fee for a lost room card key.
Please make sure to return your room card key at the front desk when leaving the hotel.£
 For the safety of our guests, we request to meet your visitors at the lobby of the hotel.£
When someone knocks at the door, please put on the door latch or check at the
peephole.£
 Please refrain from using fires such as lighting up candles without the permission of the
hotel. Also, cooking inside the guest room is strictly prohibited.£
Even if it is possible to smoke inside the room, please refrain from smoking near items
that are prone to fire such as the bed.£
Smoking is strictly prohibited inside the hotel except for the designated smoking area.
Other than accommodation, please refrain from using the guest room for any other
purposes such as business activities, offices, parties, etc. without permission from the
hotel.£
Please do not move, modify or make any alteration to any equipment inside your room without the permission from the hotel.
Taking any equipment outside the room is not allowed.£
Do not place anything on the window that would damage the appearance of the hotel.
Please be sure to manage your valuables and expensive items.£
The storage period for checked-in and forgotten items are as follows:
Food (unopened): 3 days from the date of discovery
Other than food: 1 month from the date of discovery£
If item is not collected within the storage period, it will be considered that the guest has abandoned
its ownership and can be disposed freely by the hotel. In this case, guest may not be able to object
or retrieve the item.£
We will handle the lost items according to the law.£
 Please follow the guide and instructions provided by the hotel staff.
Do not store valuables or other items in the parked car. Hotel will not be responsible for
any loss or theft during parking.£
Please note that the hotel staff are not allowed to move the car on behalf of the guest.
Payment will be accepted in cash, travel check, accommodation voucher, credit card, or
any vouchers approved by the hotel.£
Please pay the bill upon arrival or when a request to avail a particular item or service has
been made.£
  If the booked name is different from the staying guest, in cases that the payment is not
made on the stipulated date, it will be billed directly to the customer who made the
reservation.£
  Hotel will not pay for online shopping fee, taxi fee, postage stamps, and fee for the
delivery of baggage.£
Refunds will not be given for unused breakfast vouchers.£
Unused special offers and discount tickets issued by the hotel will not be refunded.
Please refrain from bringing in the following items or acts that may cause inconvenience to
other guests in the hotel.
Animals and pets such as dogs, cats, and small birds in general (except for guide
dogs, service dogs, and hearing dogs)
Explosives and highly sensitive oils that can be easily ignited or any dangerous
products
A substance that produces a bad odour or has a strong smell
Guns and swords without a permit
Remarkably large amount of luggage and goods
Other items and behaviours that are prohibited by law:
Gambling, being offensive to other guests, behaviour that disrupts
orderliness, or behavior that may cause disgust or annoyance to other
guests. Entering the hotel in “Geta”(Japanese traditional slippers) & leathered –
soled sandals , Roller blades and Roller skates
Moving equipment or using it for purposes other than its intended purpose
Distribution of advertising materials, sales of goods and solicitation
Taking in food and drink from outside the hotel
Use of public bath when drunk or with tattoo
Taking out of food and drink from breakfast (excluding those that can be
taken out)£
  Taking photographs within hotel premises that may bother or cause
disturbance to other guests£
  This rule corresponds to the standard provisions of the Civil Code, and each provision of this
regulation may be changed based on Article 19 of the Accommodation Provisions.£
According to this change of rule, the contents of the changed terms, conditions and effective date
will be posted on the website specified by the hotel and inside the guestroom one month before the
effective date instead of individual notice and explanation.£"
