,question,answer,question_index,answer_index,document_index
43,,"
The Hotel is liable to the Customer for property brought into the Hotel in accordance with the statutory provisions. The Hotel
recommends the use of the safe at the Hotel reception. If the guest wishes to bring money, securities and valuables with a value of more
than €800 or other items with a value of more than €3’500 into the Hotel, a separate safekeeping agreement with the Hotel is necessary.
Insofar as a parking space is provided to the Customer in the Hotel garage or a Hotel parking lot, this does not constitute a
safekeeping agreement, even if a fee is charged. The Hotel only assumes liability pursuant to the preceding No. 10.1 for loss of or damage
to motor vehicles parked or maneuvered on the Hotel’s property, as well as for loss of or damage to its contents.",C,26,2
44,"What is the primary responsibility of the Hotel regarding wake-up calls? 
","
Wake-up calls are carried out by the Hotel with the greatest possible diligence. Messages, mail and deliveries for guests are handled
with care. The Hotel delivers, stores, and – on request and against payment – forwards such items. The Hotel only assumes liability hereby
according to the pre-ceding No. 10.1.",O,27,2
45," What types of items are handled by the Hotel for guests? 
","
Wake-up calls are carried out by the Hotel with the greatest possible diligence. Messages, mail and deliveries for guests are handled
with care. The Hotel delivers, stores, and – on request and against payment – forwards such items. The Hotel only assumes liability hereby
according to the pre-ceding No. 10.1.",C,27,2
46," Can guests request the Hotel to forward their items to another location? 
","
Wake-up calls are carried out by the Hotel with the greatest possible diligence. Messages, mail and deliveries for guests are handled
with care. The Hotel delivers, stores, and – on request and against payment – forwards such items. The Hotel only assumes liability hereby
according to the pre-ceding No. 10.1.",C,27,2
47, What is the condition under which the Hotel assumes liability for handling guest items?,"
Wake-up calls are carried out by the Hotel with the greatest possible diligence. Messages, mail and deliveries for guests are handled
with care. The Hotel delivers, stores, and – on request and against payment – forwards such items. The Hotel only assumes liability hereby
according to the pre-ceding No. 10.1.",C,27,2
48,What are the customer's responsibilities in case of a disruption to the hotel's performance?,"
Upon knowledge or prompt objection by the Customer, the Hotel will act to remedy possible disruptions or defects in its performance.
The Customer is obliged to undertake reasonable actions in order to remedy the disruption and to keep a possible damage to a minimum.",O,28,2
49,"Is smoking allowed in public areas of the hotel? 
Is e-cigarette use permitted in hotel rooms? 
What is the penalty for violating the hotel's no-smoking policy?","
Smoking (including e-cigarettes or similar) in a non-smoking room is prohibited. Smoking (included e-cigarettes or similar) is also not
permitted in the public areas of the hotel. Violation of this no-smoking policy entitles the hotel to terminate the contract without notice. In any
case the hotel will invoice any costs for special cleaning of the hotel room in the amount of EUR 150.00 to the customer.",O,29,2
50,What are the consequences for a hotel guest who triggers the fire alarm by smoking in a hotel room or public area?,"
The hotel rooms are fitted with sensitive automated smoke alarms. If smoking in the hotel room or public areas causes an activation of
the automatic fire alarm, resulting in an intervention by the police and the fire brigade, the customer shall bear any costs incurred, however
at least EUR 800.",O,30,2
51,,"
Dogs may only be kept after obtaining prior written consent from the hotel. The costs for keeping dogs are not included in the room
rate. The customer shall also bear any costs incurred for extra or special cleaning, e.g. soiling or damage, as a result of keeping a
dog/dogs. Other pets than dogs are not allowed.",O,31,2
52," Are there any costs associated with keeping dogs at the hotel? 
","
Dogs may only be kept after obtaining prior written consent from the hotel. The costs for keeping dogs are not included in the room
rate. The customer shall also bear any costs incurred for extra or special cleaning, e.g. soiling or damage, as a result of keeping a
dog/dogs. Other pets than dogs are not allowed.",C,31,2
53," What types of pets are allowed at the hotel? 
","
Dogs may only be kept after obtaining prior written consent from the hotel. The costs for keeping dogs are not included in the room
rate. The customer shall also bear any costs incurred for extra or special cleaning, e.g. soiling or damage, as a result of keeping a
dog/dogs. Other pets than dogs are not allowed.",C,31,2
54, Is there a specific process for obtaining consent to keep a dog at the hotel?,"
Dogs may only be kept after obtaining prior written consent from the hotel. The costs for keeping dogs are not included in the room
rate. The customer shall also bear any costs incurred for extra or special cleaning, e.g. soiling or damage, as a result of keeping a
dog/dogs. Other pets than dogs are not allowed.",C,31,2
55,"What is the purpose of the text provided? 
Who is liable for damages to hotel room items beyond usual wear and tear? 
What is prohibited when using the hotel's internet connection? 
What type of files are considered copyrighted and cannot be shared? 
What will the customer be liable for in case of copyright infringement?","
In case any furnishing and/or fixtures (e.g. furniture, built-in furniture, floor coverings, etc.) and/or other items and materials used and
provided in the hotel rooms and the hotel building (e.g. pillows, duvets, mattresses, towels, etc.) will be damaged or soiled beyond the
usual measure, the customer will bear the costs for renewal, replacement and/or repair in any case. 12 TECHNICAL INSTALLATIONS, CONNECTIONS AND INTERNET USE
The customer is not permitted to carry out any illegal file sharing using the internet connection provided by the hotel. This includes, in
particular, any uploading or downloading of copyrighted text, music, film or software files. The customer shall be liable for all damages
suffered by the hotel and/or the copyright holder for the violation.",O,32,2
56,"What is the purpose of the hotel's disclaimer about the internet connection? 
Is the hotel liable for damages to the customer's electronic devices? 
What types of devices are the hotel warning customers about potential damage to? 
Can the hotel be held responsible for the contents of websites accessed through their internet? 
What is the hotel's policy regarding the use of the internet by its customers?","
The hotel gives no guarantee for the actual availability, suitability or reliability of the internet connection for any purpose. Furthermore,
the hotel is not liable for any damages to the Customer’s PC, tablet, smartphone etc. resulting from the use of the internet. In particular, the
hotel is not liable for the contents of any websites called up or any downloaded files. Furthermore, no liability will be assumed for any
viruses caused by use of the internet. The customer shall use the internet at his own risk.",O,33,2
57,What is the duration of the statutory limitation period for claims against the Hotel? ,"
All claims against the Hotel shall generally prescribe one year after the commencement of the statutory limitation period.
The reduction of the statutory limitation period in No. 11.1 does neither apply to damage claims, nor to claims which are based on an
intentional or grossly negligent breach of obligation by the Hotel.",O,34,2
58," 
What type of claims are exempt from the reduced statutory limitation period?","
All claims against the Hotel shall generally prescribe one year after the commencement of the statutory limitation period.
The reduction of the statutory limitation period in No. 11.1 does neither apply to damage claims, nor to claims which are based on an
intentional or grossly negligent breach of obligation by the Hotel.",C,34,2
59,"Where is the ""Privacy Notice for Guests"" typically located?","
You can find more detailed information about the handling of your personal data in our “Privacy Notice for Guests”, which is available
at the Reception.",O,35,2
60,What is the purpose of the ODR platform? ,"
In compliance with its statutory obligation the hotel points out that the European Union has set up an online platform for the
extrajudicial resolution of consumer disputes (“ODR platform”): http://ec.europa.eu/consumers/odr/",O,36,2
61, Is the ODR platform a mandatory or optional process for resolving consumer disputes?,"
In compliance with its statutory obligation the hotel points out that the European Union has set up an online platform for the
extrajudicial resolution of consumer disputes (“ODR platform”): http://ec.europa.eu/consumers/odr/",C,36,2
62,Does the hotel accept parcels and mail items addressed to guests who have not yet arrived?,"
The hotel does not, however, participate in dispute resolution proceedings held before consumer dispute resolution bodies.
Parcels and other postal or mail items are accepted by the hotel only if they are addressed to an overnight guest or to an event known
to the hotel and are pre-registered for an overnight stay or an event or have already arrived at the hotel.",O,37,2
63,Will unregistered parcels or letters be accepted by the hotel?,"
However, these parcel or letter and postal consignments will only be accepted if they have been registered in good time by the
consignor. Unregistered parcel or letter and mail items, as well as not clearly addressed items (for example missing guest or event name)
will not be accepted by the hotel and will be returned to the sender.",O,38,2
64,What costs are typically associated with customs clearance?,"
The hotel does not assume any costs for any customs clearance.",O,39,2
65,"What is the purpose of sending requests to the email address hotel.munich.airport@movenpick.com?
What type of deliveries are typically sent to the email address hotel.munich.airport@movenpick.com?","
If a sender does not have a personal contact person at the hotel, requests for deliveries can be sent to the following e-mail:
hotel.munich.airport@movenpick.com",O,40,2
66,What is the condition for making amendments to the Contract or General Terms and Conditions?,"
Amendments and supplements to the Contract or to the acceptance of offers or to these General Terms and Conditions should be
made in writing. Unilateral amendments or supplements by the Customer are invalid.",O,41,2
67,What is the place of performance and payment according to the text?,"
In commercial transactions, the place of performance and payment is the place where the particular Hotel is located. In commercial
transactions, as well as when the Customer lacks a place of general jurisdiction within the country according to Section 38, paragraph 2 of
the German Code of Civil Procedure (ZPO), the courts at the seat of the Operating Company shall have exclusive jurisdiction in all disputes
arising out of or in connection with the Contract or these General Terms and Conditions, including in disputes concerning checks and bills
of exchange.",O,42,2
68,"What is the law governing the Contract and these General Terms and Conditions? 
What happens if one or more provisions of the General Terms and Conditions are deemed invalid?","
The Contract and these General Terms and Conditions are governed exclusively by German substantive law, without the application
of its conflict of law’s provisions. The application of the UN Convention on Contracts for the International Sale of Goods is precluded.
Should individual provisions of these General Terms and Conditions be or become invalid or void, the validity of the remaining
provisions shall re-main unaffected thereby.",O,43,2
69,What is the official language of the General Terms and Conditions?,"
The approved English version of these General Terms and Conditions shall take precedence over its translations.",O,44,2
