,question,answer,question_index,answer_index,document_index
0,What does the Operating Company's seat location indicate?,"When the Customer enters into a contract with Mövenpick Hotels Deutschland GmbH (seat: Frankfurt am Main, Amtsgericht Frankfurt
am Main HRB108250, Germany) (Operating Company) for the rent of hotel rooms in one of the hotels operated by the Operating Company
in Germany, as well as other services rendered and goods delivered to the Customer in this context (Hotel Accommodation
Contract/Contract) these General Terms and Conditions become an integral part of the Contract.",O,0,2
1,"What does ""expressly agreed"" refer to in this context?","
The Customer’s general terms and conditions apply only if this is previously expressly agreed.",O,1,2
2,What is the name of the operating company mentioned in the contract? ,"
The contracting parties are Mövenpick Hotels Deutschland GmbH (Operating Company) and the Customer. The performance of the
Operating Company within the scope of the Contract is carried out by the particular hotel branch of the Operating Company (Hotel).
The Contract shall come into force upon the Hotel’s acceptance of the Customer’s offer.",O,2,2
3, Who is responsible for carrying out the performance of the Operating Company within the contract?,"
The contracting parties are Mövenpick Hotels Deutschland GmbH (Operating Company) and the Customer. The performance of the
Operating Company within the scope of the Contract is carried out by the particular hotel branch of the Operating Company (Hotel).
The Contract shall come into force upon the Hotel’s acceptance of the Customer’s offer.",C,2,2
4,"What are the unforeseen reasons that might prevent the Hotel from keeping available the rooms reserved by the Customer? 
What services is the Hotel obliged to render to the Customer? 
What happens if no room in the reserved category is available upon arrival at the Hotel? 
Does the Hotel assume liability for the services of the other hotel operator in case accommodation is organized in another hotel? 
What is provided to the guest by the Hotel in case accommodation is organized in another hotel?","
The Hotel is obliged to keep available the rooms reserved by the Customer and to render the agreed services. Should for unforeseen
reasons no room in the reserved category be available upon arrival, the Hotel will provide a room in the next higher category. Should no
room be available in the Hotel, the Hotel can organize accommodation in another, at least equivalent hotel. The Hotel does not assume
liability for the services of the other hotel operator. The Hotel provides transport to and from the other hotel with luggage as well as a three
minute international phone call, for the purpose of informing about the new address. Furthermore, the Hotel provides a voucher for an
equivalent hotel room valid for the guest’s next stay in the Hotel.",O,3,2
5,What are the services that the Hotel disburses for third parties that the Customer orders directly or via the Hotel?,"
The Customer is obliged to pay to the Hotel the agreed or applicable prices for the room rental and other services provided. This also
applies to services ordered directly by the Customer or via the Hotel, which a third party provides and the Hotel disburses.",O,4,2
6,Does the extraordinary termination right apply to consumers in this situation?,"
The Hotel’s prior written consent is required if the Customer wishes to sublet the provided rooms or use them for other than lodging
purposes. Insofar as the Customer is not a consumer, the extraordinary termination right in case of lacking consent of the Hotel, Section
540, paragraph 1, sentence 2 German Civil Code (BGB), is waived.",O,5,2
7,What are the conditions under which a customer can request a specific room?,"
The Customer does not have the right to be provided specific rooms, unless this is expressly agreed.",O,6,2
8,What is the earliest time that a customer can check into a reserved room?,"
Reserved rooms are available to the Customer from 3:00 p.m. on the agreed arrival date. The Customer cannot claim an earlier
handover.",O,7,2
9,"What are the consequences if a customer fails to vacate their room by the agreed departure time? 
","
Rooms must be vacated and made available to the Hotel no later than 12:00 noon on the agreed departure date. Should the Customer
not adhere to this provision, the Hotel may charge 50% of the full accommodation rate (list price) for the delayed vacation of the room until
6:00 p.m., and 90% after 6:00 p.m. The Customer does not obtain any contractual claims hereby. The Customer is at liberty to prove that
the Hotel’s claim based on the use of the room does not exist or is much lower.",O,8,2
10, What percentage of the accommodation rate will the hotel charge if the customer stays beyond 6:00 p.m.?,"
Rooms must be vacated and made available to the Hotel no later than 12:00 noon on the agreed departure date. Should the Customer
not adhere to this provision, the Hotel may charge 50% of the full accommodation rate (list price) for the delayed vacation of the room until
6:00 p.m., and 90% after 6:00 p.m. The Customer does not obtain any contractual claims hereby. The Customer is at liberty to prove that
the Hotel’s claim based on the use of the room does not exist or is much lower.",C,8,2
11,Is the use of photographs taken of the Hotel interior for personal purposes allowed?,"
The use for commercial purposes of photographs taken of the Hotel interior, both of the common areas and the Hotel rooms is
prohibited.",O,9,2
12,What types of taxes are included in the agreed prices? ,"
The taxes, including local taxes, in effect at the time of conclusion of the Contract, are included in the agreed prices, with the exception
of locally levied taxes which are owed directly by the guest according to the particular municipal law, for example a visitor’s tax. If the
statutory value added tax is changed or if local taxes are newly introduced, changed or abolished after conclusion of the Contract, the
prices will be adjusted accordingly. Insofar as the Customer is a consumer, this only applies if four months have passed between the
conclusion and fulfilment of the Contract.",O,10,2
13," 
What happens to the prices if there is a change in statutory value added tax after the contract is concluded?","
The taxes, including local taxes, in effect at the time of conclusion of the Contract, are included in the agreed prices, with the exception
of locally levied taxes which are owed directly by the guest according to the particular municipal law, for example a visitor’s tax. If the
statutory value added tax is changed or if local taxes are newly introduced, changed or abolished after conclusion of the Contract, the
prices will be adjusted accordingly. Insofar as the Customer is a consumer, this only applies if four months have passed between the
conclusion and fulfilment of the Contract.",C,10,2
14,Can the hotel increase the price for the rooms and/or services if the customer wants to extend their stay?,"
Should the Customer wish to reduce the number of reserved rooms, the services of the Hotel or the Customer’s length of stay, the Hotel
can increase the price for the rooms and/or for the other services.",O,11,2
15,What happens if the invoice from the Hotel is not paid within the specified ten-day period?,"
Invoices from the Hotel without a payment date are due within ten days of receipt of the invoice.",O,12,2
16,What are the consequences of default of payment according to the statutory rules mentioned in the text? ,"
The Hotel can demand immediate payment of due debt from the Customer. The statutory rules concerning the consequences of default
of payment apply. The Hotel reserves the right to prove greater damage.",O,13,2
17,"
Can the Hotel demand immediate payment of due debt from the Customer if they have not been given a prior notice?","
The Hotel can demand immediate payment of due debt from the Customer. The statutory rules concerning the consequences of default
of payment apply. The Hotel reserves the right to prove greater damage.",C,13,2
18,"What does ""res judicata"" mean in the context of the hotel's claim?","
The Customer may only set off a claim by the Hotel against a claim, which is undisputed or decided with final, res judicata effect.",O,14,2
19,What type of payment is Mövenpick Hotels & Resorts allowed to require from the Customer upon conclusion of the Contract? ,"
Upon conclusion of the Contract, the Hotel may require a reasonable advance payment or the provision of a security, such as a credit
card guarantee, from the Customer. In case of an advance payment on the website of Mövenpick Hotels & Resorts, the payment is
processed via Mövenpick Hotels Deutschland GmbH, the parent company of the Operating Company. Mövenpick Hotels Deutschland
GmbH forwards the payment to the respective Hotel and has only an intermediary role for the purpose of the credit card payment.",O,15,2
20," 
What role does Mövenpick Hotels Deutschland GmbH play in processing credit card payments for Mövenpick Hotels & Resorts?","
Upon conclusion of the Contract, the Hotel may require a reasonable advance payment or the provision of a security, such as a credit
card guarantee, from the Customer. In case of an advance payment on the website of Mövenpick Hotels & Resorts, the payment is
processed via Mövenpick Hotels Deutschland GmbH, the parent company of the Operating Company. Mövenpick Hotels Deutschland
GmbH forwards the payment to the respective Hotel and has only an intermediary role for the purpose of the credit card payment.",C,15,2
21,What are the statutory provisions that are exempt from the general terms and conditions of Mövenpick Hotels Deutschland GmbH? ,"
Mövenpick Hotels Deutschland GmbH does not assume liability for the provision of the hotel services according to these General Terms
and Conditions and the Contract. The statutory provisions relating to advance payments or to securities in connection with package tours shall remain unaffected. The statutory rules concerning the consequences of default of payment apply.",O,16,2
22,"
Who is liable in case of default of payment according to the statutory rules mentioned in the text?","
Mövenpick Hotels Deutschland GmbH does not assume liability for the provision of the hotel services according to these General Terms
and Conditions and the Contract. The statutory provisions relating to advance payments or to securities in connection with package tours shall remain unaffected. The statutory rules concerning the consequences of default of payment apply.",C,16,2
23,"What does the Hotel demand in justified cases, e.g. the Customer’s default in payment? 
What is the purpose of the advance payment or security demanded by the Hotel at the beginning of and during the stay? 
Can the Hotel increase the advance payment or security agreed upon in the Contract up to the total agreed remuneration?","
In justified cases, e.g. the Customer’s default in payment or the expansion of the scope of the Contract, the Hotel may, after the
conclusion of the Con-tract and up to the commencement of the stay, demand an advance payment or the provision of a security within the meaning of the above-mentioned No. 7.1 or an increase of the advance payment or security agreed upon in the Contract up to the total agreed remuneration. Furthermore, the Hotel is entitled, at the beginning of and during the stay, to demand a reasonable advance payment or the provision of
a security within the meaning of the above-mentioned No. 7.1 for existing and future claims arising from the Contract, insofar as such
advance payment has not already been made or such security not already been provided pursuant to the above-mentioned No.",O,17,2
24,Can the customer withdraw from the contract without the hotel's consent if a statutory right of withdrawal exists?,"
The Customer can only withdraw from the Contract if a right of withdrawal was explicitly agreed upon in the Contract, if a statutory right
of withdrawal exists or if the Hotel gives its explicit consent to the withdrawal. The agreement on a right of withdrawal as well as the consent
to withdrawal shall be made in writing.",O,18,2
25,What is the condition for the customer to withdraw from the contract without incurring payment or damage claims?,"
Insofar as the Hotel and the Customer have agreed upon a date for a possible withdrawal from the Contract at no cost, the Customer
may withdraw from the Contract up to that date, without incurring payment or damage claims by the Hotel.",O,19,2
26,"What are the conditions under which the customer is not entitled to withdraw from the contract? 
","
In case the Customer is not entitled to withdraw from the Contract, the agreed remuneration is owed, regardless of whether the agreed
services are used. If the Hotel can rent out the rooms to other customers, it must credit the income and the saved expenses against the
agreed remuneration. If the rooms are not rented out to other customers, the Hotel can assess a lump sum for the saved expenses. In this
case, the Customer is obligated to pay at least 90% of the contractually agreed total rate for lodging with or without breakfast as well as all-
inclusive arrangements with external services, 70% for half-board and 60% for full-board arrangements. The Customer is at liberty to prove
that the above-mentioned claim does not exist or does not amount to the demanded sum.",O,20,2
27," If the hotel cannot rent out the rooms to other customers, what percentage of the contractually agreed total rate does the customer have to pay? 
","
In case the Customer is not entitled to withdraw from the Contract, the agreed remuneration is owed, regardless of whether the agreed
services are used. If the Hotel can rent out the rooms to other customers, it must credit the income and the saved expenses against the
agreed remuneration. If the rooms are not rented out to other customers, the Hotel can assess a lump sum for the saved expenses. In this
case, the Customer is obligated to pay at least 90% of the contractually agreed total rate for lodging with or without breakfast as well as all-
inclusive arrangements with external services, 70% for half-board and 60% for full-board arrangements. The Customer is at liberty to prove
that the above-mentioned claim does not exist or does not amount to the demanded sum.",C,20,2
28," What is the minimum percentage of the contractually agreed total rate that the customer must pay if the rooms are not rented out to other customers? 
","
In case the Customer is not entitled to withdraw from the Contract, the agreed remuneration is owed, regardless of whether the agreed
services are used. If the Hotel can rent out the rooms to other customers, it must credit the income and the saved expenses against the
agreed remuneration. If the rooms are not rented out to other customers, the Hotel can assess a lump sum for the saved expenses. In this
case, the Customer is obligated to pay at least 90% of the contractually agreed total rate for lodging with or without breakfast as well as all-
inclusive arrangements with external services, 70% for half-board and 60% for full-board arrangements. The Customer is at liberty to prove
that the above-mentioned claim does not exist or does not amount to the demanded sum.",C,20,2
29, Can the customer dispute the hotel's claim for saved expenses?,"
In case the Customer is not entitled to withdraw from the Contract, the agreed remuneration is owed, regardless of whether the agreed
services are used. If the Hotel can rent out the rooms to other customers, it must credit the income and the saved expenses against the
agreed remuneration. If the rooms are not rented out to other customers, the Hotel can assess a lump sum for the saved expenses. In this
case, the Customer is obligated to pay at least 90% of the contractually agreed total rate for lodging with or without breakfast as well as all-
inclusive arrangements with external services, 70% for half-board and 60% for full-board arrangements. The Customer is at liberty to prove
that the above-mentioned claim does not exist or does not amount to the demanded sum.",C,20,2
30,What is the specific date mentioned in the text that the customer and the hotel can withdraw from the contract?,"
Insofar as it was agreed that the Customer can withdraw from the Contract at no cost up to a certain date, the Hotel may also withdraw
from the Con-tract up to this date, if the Customer does not, upon inquiry by the Hotel with a reasonable grace period, waive its right of
withdrawal.",O,21,2
31,"What is the reason for the hotel to withdraw from the contract according to the text? 
What is the consequence of the customer not paying an advance payment or providing a security as agreed upon?","
The Hotel may also withdraw from the Contract if the Customer does not pay an advance payment or provide a security agreed upon or
demanded pursuant to No. 7.1 and/or No. 7.2, even after a reasonable grace period set by the Hotel has expired.",O,22,2
32,What are the circumstances that justify the Hotel's extraordinary withdrawal from the Contract?,"
Moreover, the Hotel has the right of extraordinary withdrawal from the Contract for a materially justifiable cause, in particular if
force majeure or other circumstances beyond the Hotel’s control render the fulfilment of the Contract impossible;
rooms are reserved with culpably misleading or false information or concealment regarding essential facts; the identity or
solvency of the Customer or the purpose of the Customer’s stay can constitute essential facts;
the Hotel has justified cause to believe that use of the Hotel’s services might jeopardize the smooth operation, the security or
the public reputation of the Hotel, without being attributable to the Hotel’s sphere of control;
the purpose or the occasion of the stay is illegal;
there is a breach of the above-mentioned No. 4.1.",O,23,2
33,What are the implications of the hotel's justified withdrawal on the customer's rights?,"
The justified withdrawal by the Hotel constitutes no claim for damages for the Customer.",O,24,2
34,What are the conditions under which the Hotel is liable for damages? ,"
Unless stipulated otherwise in this No. 10, the Hotel is only liable for damages caused with intent or gross negligence. For damages
due to slight negligence, the Hotel is only liable when the damages have been caused by harm inflicted on life, limb or physical health, and
in case of damages due to violation of essential contractual obligations of the Hotel. In the latter case, the liability is limited to the
foreseeable, typically occurring damage. A breach of obligation of the Hotel is deemed to be the equivalent to a breach of a statutory
representative or vicarious agent.",O,25,2
35," 
What is the extent of the Hotel's liability for damages caused by slight negligence? ","
Unless stipulated otherwise in this No. 10, the Hotel is only liable for damages caused with intent or gross negligence. For damages
due to slight negligence, the Hotel is only liable when the damages have been caused by harm inflicted on life, limb or physical health, and
in case of damages due to violation of essential contractual obligations of the Hotel. In the latter case, the liability is limited to the
foreseeable, typically occurring damage. A breach of obligation of the Hotel is deemed to be the equivalent to a breach of a statutory
representative or vicarious agent.",C,25,2
36," 
In what cases is the Hotel's liability for damages limited? ","
Unless stipulated otherwise in this No. 10, the Hotel is only liable for damages caused with intent or gross negligence. For damages
due to slight negligence, the Hotel is only liable when the damages have been caused by harm inflicted on life, limb or physical health, and
in case of damages due to violation of essential contractual obligations of the Hotel. In the latter case, the liability is limited to the
foreseeable, typically occurring damage. A breach of obligation of the Hotel is deemed to be the equivalent to a breach of a statutory
representative or vicarious agent.",C,25,2
37," 
What type of damages are the Hotel's liability limited to in case of a breach of essential contractual obligations?","
Unless stipulated otherwise in this No. 10, the Hotel is only liable for damages caused with intent or gross negligence. For damages
due to slight negligence, the Hotel is only liable when the damages have been caused by harm inflicted on life, limb or physical health, and
in case of damages due to violation of essential contractual obligations of the Hotel. In the latter case, the liability is limited to the
foreseeable, typically occurring damage. A breach of obligation of the Hotel is deemed to be the equivalent to a breach of a statutory
representative or vicarious agent.",C,25,2
38,"What is the maximum value of money, securities, and valuables that can be brought into the hotel without a separate safekeeping agreement? ","
The Hotel is liable to the Customer for property brought into the Hotel in accordance with the statutory provisions. The Hotel
recommends the use of the safe at the Hotel reception. If the guest wishes to bring money, securities and valuables with a value of more
than €800 or other items with a value of more than €3’500 into the Hotel, a separate safekeeping agreement with the Hotel is necessary.
Insofar as a parking space is provided to the Customer in the Hotel garage or a Hotel parking lot, this does not constitute a
safekeeping agreement, even if a fee is charged. The Hotel only assumes liability pursuant to the preceding No. 10.1 for loss of or damage
to motor vehicles parked or maneuvered on the Hotel’s property, as well as for loss of or damage to its contents.",O,26,2
39,"
What is the value limit for other items that require a separate safekeeping agreement? ","
The Hotel is liable to the Customer for property brought into the Hotel in accordance with the statutory provisions. The Hotel
recommends the use of the safe at the Hotel reception. If the guest wishes to bring money, securities and valuables with a value of more
than €800 or other items with a value of more than €3’500 into the Hotel, a separate safekeeping agreement with the Hotel is necessary.
Insofar as a parking space is provided to the Customer in the Hotel garage or a Hotel parking lot, this does not constitute a
safekeeping agreement, even if a fee is charged. The Hotel only assumes liability pursuant to the preceding No. 10.1 for loss of or damage
to motor vehicles parked or maneuvered on the Hotel’s property, as well as for loss of or damage to its contents.",C,26,2
40,"
What is the purpose of the safe at the hotel reception according to the hotel? ","
The Hotel is liable to the Customer for property brought into the Hotel in accordance with the statutory provisions. The Hotel
recommends the use of the safe at the Hotel reception. If the guest wishes to bring money, securities and valuables with a value of more
than €800 or other items with a value of more than €3’500 into the Hotel, a separate safekeeping agreement with the Hotel is necessary.
Insofar as a parking space is provided to the Customer in the Hotel garage or a Hotel parking lot, this does not constitute a
safekeeping agreement, even if a fee is charged. The Hotel only assumes liability pursuant to the preceding No. 10.1 for loss of or damage
to motor vehicles parked or maneuvered on the Hotel’s property, as well as for loss of or damage to its contents.",C,26,2
41,"
Is a parking space provided by the hotel considered a safekeeping agreement? ","
The Hotel is liable to the Customer for property brought into the Hotel in accordance with the statutory provisions. The Hotel
recommends the use of the safe at the Hotel reception. If the guest wishes to bring money, securities and valuables with a value of more
than €800 or other items with a value of more than €3’500 into the Hotel, a separate safekeeping agreement with the Hotel is necessary.
Insofar as a parking space is provided to the Customer in the Hotel garage or a Hotel parking lot, this does not constitute a
safekeeping agreement, even if a fee is charged. The Hotel only assumes liability pursuant to the preceding No. 10.1 for loss of or damage
to motor vehicles parked or maneuvered on the Hotel’s property, as well as for loss of or damage to its contents.",C,26,2
42,"
What is the hotel's liability for loss or damage to motor vehicles parked on its property? ","
The Hotel is liable to the Customer for property brought into the Hotel in accordance with the statutory provisions. The Hotel
recommends the use of the safe at the Hotel reception. If the guest wishes to bring money, securities and valuables with a value of more
than €800 or other items with a value of more than €3’500 into the Hotel, a separate safekeeping agreement with the Hotel is necessary.
Insofar as a parking space is provided to the Customer in the Hotel garage or a Hotel parking lot, this does not constitute a
safekeeping agreement, even if a fee is charged. The Hotel only assumes liability pursuant to the preceding No. 10.1 for loss of or damage
to motor vehicles parked or maneuvered on the Hotel’s property, as well as for loss of or damage to its contents.",C,26,2
